{
  "video_id": "df3a612a35031034",
  "title": "用主动回忆和每周复盘改进计划",
  "summary": "示范不看资料解释知识点，再用小练习核对掌握情况。最后根据复盘记录调整后续任务。",
  "topics": [
    "主动回忆",
    "练习",
    "复盘"
  ],
  "relevance": 98,
  "segments": [
    {
      "start": 0,
      "end": 90,
      "title": "闭卷解释一个概念",
      "summary": "讲师示范在不看资料的情况下解释概念。解释后再对照原材料，找出遗漏或理解错误。",
      "keypoints": [
        "先回忆再核对",
        "记录无法解释的部分"
      ],
      "label": "must",
      "reason": "直接示范通过主动回忆检查掌握程度的方法。"
    },
    {
      "start": 90,
      "end": 180,
      "title": "根据练习结果调整学习计划",
      "summary": "将练习错误分类并记录到复盘表。依据错误类型决定重看概念、增加练习或调整进度。",
      "keypoints": [
        "区分理解错误与操作错误",
        "用练习结果调整任务"
      ],
      "label": "normal",
      "reason": "连接主动回忆与后续学习安排，需要正常理解。"
    },
    {
      "start": 180,
      "end": 270,
      "title": "再做一遍相同的复盘流程",
      "summary": "用第二道同类练习重复前面的核对方法。流程已经介绍，适合加速巩固。",
      "keypoints": [
        "重复练习核对步骤",
        "将问题加入下周任务"
      ],
      "label": "speed",
      "speed": 1.5,
      "reason": "内容相关但步骤重复，建议一点五倍速。"
    },
    {
      "start": 270,
      "end": 360,
      "title": "课后闲聊",
      "summary": "讲师分享与学习方法无关的个人行程。没有新增主动回忆或复盘知识点。",
      "keypoints": [
        "个人行程闲聊"
      ],
      "label": "skip",
      "reason": "与两个学习目标均无直接关系。"
    }
  ]
}
