{
  "video_id": "1826e5de3ff6b05b",
  "title": "把学习目标拆成每日任务",
  "summary": "介绍目标拆解、日程安排和每周复盘。配合例子形成可以执行的学习计划。",
  "topics": [
    "学习目标",
    "时间安排",
    "复盘"
  ],
  "relevance": 95,
  "segments": [
    {
      "start": 0,
      "end": 60,
      "title": "写出可检验的学习目标",
      "summary": "把模糊的愿望改写成可以检查的成果。示例以独立完成一张统计图作为阶段目标。",
      "keypoints": [
        "成果要能被检验",
        "将大目标分解成小任务"
      ],
      "label": "must",
      "reason": "直接对应制定可执行学习计划的目标。"
    },
    {
      "start": 60,
      "end": 120,
      "title": "为每天安排固定学习时段",
      "summary": "解释固定时段如何降低开始学习的阻力。用每日二十分钟的例子说明任务与可用时间的匹配。",
      "keypoints": [
        "任务量要匹配可用时间",
        "为学习预留固定时段"
      ],
      "label": "normal",
      "reason": "提供目标落地所需的时间安排背景。"
    },
    {
      "start": 120,
      "end": 180,
      "title": "重复演示任务清单",
      "summary": "再次演示前面已经出现的任务拆解方式。操作节奏较慢，观看时保留关键步骤即可。",
      "keypoints": [
        "按步骤记录任务",
        "重复示例用于巩固"
      ],
      "label": "speed",
      "speed": 2,
      "reason": "与学习目标相关，但主要重复前文，适合两倍速。"
    },
    {
      "start": 180,
      "end": 240,
      "title": "课程推广与片尾",
      "summary": "介绍后续付费课程并进行片尾致谢。没有补充目标拆解或学习安排的新方法。",
      "keypoints": [
        "推广信息",
        "片尾致谢"
      ],
      "label": "skip",
      "reason": "推广和致谢不对应本次学习目标。"
    }
  ]
}
