{
  "video_id": "8def9b053b34c9ea",
  "title": "无语音演示：需要人工查看画面",
  "summary": "影片没有可供分析的语音文本。此记录不推测画面中的知识内容。",
  "topics": [
    "无语音"
  ],
  "relevance": 0,
  "segments": [
    {
      "start": 0,
      "end": 60,
      "title": "无语音内容",
      "summary": "没有可读的语音或字幕。请根据实际画面自行判断是否需要观看。",
      "keypoints": [
        "无法依据语音文本判断内容"
      ],
      "label": "skip",
      "reason": "無語音內容，無法判斷"
    }
  ]
}
